{
  "$schema": "https://agent-orchestrator.dev/quality/schemas/run-attempt.v1.schema.json",
  "schemaVersion": 1,
  "runId": "review-sample-0001",
  "attempt": 1,
  "outcome": "capped",
  "completeness": "partial",
  "startedAt": "2026-08-01T09:00:00Z",
  "finishedAt": "2026-08-01T09:00:05Z",
  "archivedAt": "2026-08-01T09:00:06Z",
  "completedOperations": 1,
  "failedOperations": 0,
  "skippedOperations": 1,
  "usage": {
    "inputTokens": 1200,
    "outputTokens": 400,
    "cachedInputTokens": 0,
    "reasoningOutputTokens": null,
    "durationMs": 4000
  },
  "costSpent": 0.05,
  "currency": "USD",
  "stopReason": "Token cap reached",
  "errorCodes": [],
  "usageLedgerMonths": ["2026-08"]
}
